{"artifact_type":"targeted_evidence_assessment","assessment_id":"targeted_evidence_assessment:ai_pcb:wave_1:v1","assessment_wave":"targeted_evidence_assessment_wave_1_v1","atomic_claims":[{"alternative_explanations":[],"assessment_reason":"The normative clause directly states the scoped interface characteristics.","assessment_status":"sufficient","claim_id":"W1-A01-C01","claim_text":"OIF CEI-112G-LR-PAM4 defines a 36-58 Gsym/s PAM4 point-to-point differential interface over PCB copper traces, permits cable substitution, and specifies a reach of up to 1000 mm of backplane and two connectors.","claim_type":"fact","confidence":"medium","counterevidence":[],"denominator":"one CEI-112G-LR-PAM4 lane/channel","distance":"up to 1000 mm backplane and two connectors","er_id":"PCB-ER-A01","evidence_chain_ids":["evidence_chain:oif-cei-05.3"],"evidence_locators":[{"artifact_id":"evidence_artifact:69c8eeb0e78fa58323fc09e9","heading":null,"locator_note":"Clause 27 interface, medium and reach definition.","normalized_document_id":"normalized_document:8da679d8934c639b303024e3","section_hash":"567e4a5596855f598d60bbbdb22213e55cc5be40db8b52a48ca82cf3af2f36d3","section_index":620}],"evidence_stance":"support","evidence_strength":"high","frequency":"rate-defined; no cross-standard frequency comparison","freshness_status":"unknown","limitations":["The statement does not establish PCB manufacturing capability, capacity, bottleneck, value migration or company exposure."],"maximum_supported_cognition":"standard_interface_definition","missing_evidence":["Independent engineering interpretation outside OIF."],"product_or_standard_generation":"OIF-CEI-05.3 / CEI-112G-LR-PAM4","rate":"36-58 Gsym/s PAM4","scope":"CEI-112G-LR-PAM4 Clause 27 only","source_independence_status":"single_primary_chain","test_method":"normative interface and channel definition","topology":"point-to-point balanced differential; unidirectional"},{"alternative_explanations":[],"assessment_reason":"The clause directly defines the scoped interface class.","assessment_status":"sufficient","claim_id":"W1-A01-C02","claim_text":"OIF CEI-112G-XSR-PAM4 defines an extra-short-reach 36-58 Gsym/s PAM4 point-to-point electrical interface.","claim_type":"fact","confidence":"medium","counterevidence":[],"denominator":"one CEI-112G-XSR-PAM4 interface","distance":"extra-short-reach class; no physical-length generalization","er_id":"PCB-ER-A01","evidence_chain_ids":["evidence_chain:oif-cei-05.3"],"evidence_locators":[{"artifact_id":"evidence_artifact:69c8eeb0e78fa58323fc09e9","heading":null,"locator_note":"Clause 24 defines XSR signaling and topology.","normalized_document_id":"normalized_document:8da679d8934c639b303024e3","section_hash":"219ef4ef6a11277bd2cc0fa8a9a96fe07356fa0b7cf4e730c3b5eca065498731","section_index":522}],"evidence_stance":"support","evidence_strength":"high","frequency":"not independently assessed","freshness_status":"unknown","limitations":["The statement does not establish PCB manufacturing capability, capacity, bottleneck, value migration or company exposure."],"maximum_supported_cognition":"standard_interface_definition","missing_evidence":[],"product_or_standard_generation":"OIF-CEI-05.3 / CEI-112G-XSR-PAM4","rate":"36-58 Gsym/s PAM4","scope":"CEI-112G-XSR-PAM4 Clause 24 only","source_independence_status":"single_primary_chain","test_method":"normative interface definition","topology":"point-to-point electrical"},{"alternative_explanations":[],"assessment_reason":"The framework directly states this taxonomy; sufficiency is limited to what the framework says.","assessment_status":"sufficient","claim_id":"W1-A01-C03","claim_text":"The OIF 448G framework places same-PCBA chip-to-chip links through PCB trace or board cable with up to one connector in the MR application space.","claim_type":"fact","confidence":"medium","counterevidence":[],"denominator":"one framework-defined MR application space","distance":"same PCBA, daughter card or short mid-plane","er_id":"PCB-ER-A01","evidence_chain_ids":["evidence_chain:oif-cei-448g-framework"],"evidence_locators":[{"artifact_id":"evidence_artifact:4c00b05bf11e4dc7b47d36cb","heading":null,"locator_note":"Framework section 4.6 defines the MR application space.","normalized_document_id":"normalized_document:3289c4bd4757cb5b6c747709","section_hash":"266d2fa2bbfe2f9e00d4eb0b9d0a760cae7fcbb9905a104ce1cc6f4d428bc9e6","section_index":40}],"evidence_stance":"support","evidence_strength":"medium","frequency":"not a normative compliance value","freshness_status":"unknown","limitations":["The statement does not establish PCB manufacturing capability, capacity, bottleneck, value migration or company exposure."],"maximum_supported_cognition":"framework_application_definition","missing_evidence":[],"product_or_standard_generation":"OIF-FD-CEI-448G-01.0","rate":"448G framework context","scope":"OIF 448G framework application taxonomy","source_independence_status":"single_primary_chain","test_method":"framework taxonomy, not measured compliance","topology":"chip-to-chip through PCB trace or board cable, up to one connector"},{"alternative_explanations":[],"assessment_reason":"The architecture alternatives are directly stated in the framework.","assessment_status":"sufficient","claim_id":"W1-A01-C04","claim_text":"The OIF 448G framework describes a traditional chip-to-module VSR link as host PCB trace, connector and module PCB trace, while noting cabled-host alternatives.","claim_type":"fact","confidence":"medium","counterevidence":[],"denominator":"one framework-defined VSR application","distance":"chip-to-module VSR application space","er_id":"PCB-ER-A01","evidence_chain_ids":["evidence_chain:oif-cei-448g-framework"],"evidence_locators":[{"artifact_id":"evidence_artifact:4c00b05bf11e4dc7b47d36cb","heading":null,"locator_note":"Framework section 4.5 describes traditional and cabled-host VSR links.","normalized_document_id":"normalized_document:3289c4bd4757cb5b6c747709","section_hash":"24e4d8fa170af40aba72bd09d50dc0fa42f66527a03909711cae2e2fd2922f06","section_index":39}],"evidence_stance":"support","evidence_strength":"medium","frequency":"not a normative compliance value","freshness_status":"unknown","limitations":["The statement does not establish PCB manufacturing capability, capacity, bottleneck, value migration or company exposure."],"maximum_supported_cognition":"framework_application_definition","missing_evidence":[],"product_or_standard_generation":"OIF-FD-CEI-448G-01.0","rate":"higher-rate/448G framework context","scope":"OIF 448G framework chip-to-module discussion","source_independence_status":"single_primary_chain","test_method":"framework architecture discussion","topology":"host PCB or cabled host to pluggable module"},{"alternative_explanations":[],"assessment_reason":"The standard directly distinguishes the normative and informative metrics.","assessment_status":"sufficient","claim_id":"W1-A02-C01","claim_text":"Within CEI-112G-LR-PAM4, channel compliance is normative through COM, while the plotted insertion-loss limit is explicitly informative.","claim_type":"fact","confidence":"medium","counterevidence":[],"denominator":"one Clause 27 T-to-R channel at its specified baud rate","distance":"the Clause 27 LR channel","er_id":"PCB-ER-A02","evidence_chain_ids":["evidence_chain:oif-cei-05.3"],"evidence_locators":[{"artifact_id":"evidence_artifact:eef74cc4d075e6b996599fc3","heading":null,"locator_note":"Clause 27 defines COM computation and channel test points.","normalized_document_id":"normalized_document:8071e914d22caaed45914cac","section_hash":"813d4f1d494ea33926cefe3cb6fd12d8b999472691de85e1daa47a5c4b0d8d26","section_index":622},{"artifact_id":"evidence_artifact:eef74cc4d075e6b996599fc3","heading":null,"locator_note":"Clause 27 labels insertion loss informative rather than normative.","normalized_document_id":"normalized_document:8071e914d22caaed45914cac","section_hash":"27c88e21170a26048478f50a75c972026366506ea10f6f9a92fb0646abd37fc6","section_index":625}],"evidence_stance":"support","evidence_strength":"high","frequency":"0.05 GHz through the clause-defined range","freshness_status":"unknown","limitations":["The statement does not establish PCB manufacturing capability, capacity, bottleneck, value migration or company exposure."],"maximum_supported_cognition":"single_standard_measurement_definition","missing_evidence":[],"product_or_standard_generation":"OIF-CEI-05.3 / CEI-112G-LR-PAM4","rate":"36-58 Gsym/s","scope":"CEI-112G-LR-PAM4 channel compliance only","source_independence_status":"single_primary_chain","test_method":"COM per IEEE 802.3 procedure as modified by the cited clause; informative IL curve","topology":"test points T-to-R"},{"alternative_explanations":[],"assessment_reason":"The standard provides distinct class definitions; the claim does not compare performance across classes.","assessment_status":"sufficient","claim_id":"W1-A02-C02","claim_text":"OIF CEI assigns different 112G XSR, MR and LR channel classes to different physical/application reaches, so measurements must retain the named class denominator.","claim_type":"fact","confidence":"medium","counterevidence":[],"denominator":"one named CEI reach class; classes cannot be pooled","distance":"XSR, MR and LR are separate scoped classes","er_id":"PCB-ER-A02","evidence_chain_ids":["evidence_chain:oif-cei-05.3"],"evidence_locators":[{"artifact_id":"evidence_artifact:eef74cc4d075e6b996599fc3","heading":null,"locator_note":"XSR class definition.","normalized_document_id":"normalized_document:8071e914d22caaed45914cac","section_hash":"219ef4ef6a11277bd2cc0fa8a9a96fe07356fa0b7cf4e730c3b5eca065498731","section_index":522},{"artifact_id":"evidence_artifact:eef74cc4d075e6b996599fc3","heading":null,"locator_note":"MR class definition.","normalized_document_id":"normalized_document:8071e914d22caaed45914cac","section_hash":"a4ee1596f0248ab42753a9ea60c7bfc20c6e3030ea2dba72944292ca560fead2","section_index":600},{"artifact_id":"evidence_artifact:eef74cc4d075e6b996599